{
  "version": "1",
  "metadata": {
    "project_id": "00000000-0000-4000-8000-0000000000a1",
    "run_id": "00000000-0000-4000-8000-0000000000mo",
    "format_mode": "documentary",
    "resolution": {
      "width": 1920,
      "height": 1080
    },
    "fps": 30,
    "duration_sec": 4.0
  },
  "tracks": {
    "video": [
      {
        "id": "clip-0",
        "scene_id": "scene-0",
        "type": "image",
        "src": "D:\\HANUMAN\\scripts\\_theme_e2e\\assets\\scene_0.jpg",
        "start_sec": 0.0,
        "duration_sec": 1.0,
        "fit": "cover"
      },
      {
        "id": "clip-1",
        "scene_id": "scene-1",
        "type": "image",
        "src": "D:\\HANUMAN\\scripts\\_theme_e2e\\assets\\scene_1.jpg",
        "start_sec": 1.0,
        "duration_sec": 1.0,
        "fit": "cover"
      },
      {
        "id": "clip-2",
        "scene_id": "scene-2",
        "type": "image",
        "src": "D:\\HANUMAN\\scripts\\_theme_e2e\\assets\\scene_2.jpg",
        "start_sec": 2.0,
        "duration_sec": 1.0,
        "fit": "cover"
      },
      {
        "id": "clip-3",
        "scene_id": "scene-3",
        "type": "image",
        "src": "D:\\HANUMAN\\scripts\\_theme_e2e\\assets\\scene_3.jpg",
        "start_sec": 3.0,
        "duration_sec": 1.0,
        "fit": "cover"
      }
    ],
    "audio": [
      {
        "id": "audio-1",
        "type": "narration",
        "src": "D:\\HANUMAN\\scripts\\_theme_e2e\\assets\\narration.wav",
        "start_sec": 0.0,
        "duration_sec": 4.0,
        "volume": 1.0
      }
    ],
    "captions": [
      {
        "id": "cap-1",
        "section_id": "sec-1",
        "text": "A shared narration line for theme compare",
        "start_sec": 0.5,
        "duration_sec": 1.5
      }
    ],
    "broll": [],
    "music": []
  },
  "transitions": [],
  "overlays": [
    {
      "id": "chapter-1",
      "type": "chapter_title",
      "text": "Chapter One",
      "start_sec": 0.8,
      "duration_sec": 1.2
    },
    {
      "id": "cta-1",
      "type": "subscribe_cta",
      "text": "Subscribe",
      "start_sec": 2.5,
      "duration_sec": 1.4
    }
  ],
  "settings": {
    "captions_enabled": true,
    "music_volume": 0.0,
    "narration_volume": 1.0,
    "sfx_volume": 0.0,
    "theme_id": "modern"
  }
}