{
  "version": "1",
  "metadata": {
    "project_id": "00000000-0000-4000-8000-0000000000c1",
    "run_id": "00000000-0000-4000-8000-0000000000c2",
    "format_mode": "documentary",
    "resolution": {
      "width": 1920,
      "height": 1080
    },
    "fps": 30,
    "duration_sec": 3.0
  },
  "tracks": {
    "video": [
      {
        "id": "clip-0",
        "scene_id": "scene-0",
        "type": "image",
        "src": "D:\\HANUMAN\\scripts\\_caption_e2e\\assets\\bg.jpg",
        "start_sec": 0.0,
        "duration_sec": 3.0,
        "fit": "cover"
      }
    ],
    "audio": [
      {
        "id": "audio-1",
        "type": "narration",
        "src": "D:\\HANUMAN\\scripts\\_caption_e2e\\assets\\narration.wav",
        "start_sec": 0.0,
        "duration_sec": 3.0,
        "volume": 1.0
      }
    ],
    "captions": [
      {
        "id": "cap-1",
        "section_id": "sec-1",
        "text": "This is an intentionally long caption line that would previously overflow the frame and cover most of the preview if wrapping and margins were broken \u2014 keep it readable.",
        "start_sec": 0.4,
        "duration_sec": 2.2
      }
    ],
    "broll": [],
    "music": []
  },
  "transitions": [],
  "overlays": [],
  "settings": {
    "captions_enabled": false,
    "music_volume": 0.0,
    "narration_volume": 1.0,
    "sfx_volume": 0.0,
    "theme_id": "standard"
  }
}